{
  "$schema": "../../schemas/country.schema.json",
  "meta": {
    "sources": [
      "src.seatofpower_authored"
    ],
    "notes": "Generated by tools/pipeline/author_bgr.py (package 27)."
  },
  "id": "country.ukr",
  "depth": "Light",
  "nameKey": "country.ukr.name",
  "iso3": "UKR",
  "entityType": "Country",
  "regimeType": "ElectoralDemocracy",
  "currency": "UAH",
  "capitalKey": "country.ukr.capital",
  "mapColor": "#2F6FAF",
  "leaderCharacterId": "char.ukr.leader"
}
