{
  "$schema": "../../schemas/country.schema.json",
  "meta": {
    "sources": [
      "src.seatofpower_authored"
    ],
    "notes": "Generated by tools/pipeline/author_bgr.py (package 27)."
  },
  "id": "country.tur",
  "depth": "Light",
  "nameKey": "country.tur.name",
  "iso3": "TUR",
  "entityType": "Country",
  "regimeType": "ElectoralAutocracy",
  "currency": "TRY",
  "capitalKey": "country.tur.capital",
  "mapColor": "#B5472F",
  "leaderCharacterId": "char.tur.leader"
}
