{
  "$schema": "../../schemas/country.schema.json",
  "meta": {
    "sources": [
      "src.seatofpower_authored"
    ],
    "notes": "Made-up party names close to the real ones (D-038). Regime indicators are design estimates informed by public democracy and rule-of-law reports (no third-party data copied): a functioning electoral democracy with weak judicial independence, a captured-looking prosecution and widespread vote buying (27 §1). Generated by tools/pipeline/author_bgr.py (package 27)."
  },
  "id": "country.bgr",
  "depth": "Full",
  "nameKey": "country.bgr.name",
  "iso3": "BGR",
  "entityType": "Country",
  "regimeType": "ElectoralDemocracy",
  "currency": "EUR",
  "capitalKey": "country.bgr.capital",
  "mapColor": "#8E3B46",
  "leaderCharacterId": "char.bgr.pm",
  "parties": [
    {
      "id": "party.bgr.ph",
      "nameKey": "party.bgr.ph.name",
      "color": "#8E3B46"
    },
    {
      "id": "party.bgr.cerb",
      "nameKey": "party.bgr.cerb.name",
      "color": "#2F5D9E"
    },
    {
      "id": "party.bgr.wkg",
      "nameKey": "party.bgr.wkg.name",
      "color": "#E0A526"
    },
    {
      "id": "party.bgr.dc",
      "nameKey": "party.bgr.dc.name",
      "color": "#1F7A5A"
    },
    {
      "id": "party.bgr.mer",
      "nameKey": "party.bgr.mer.name",
      "color": "#3A4FA0"
    },
    {
      "id": "party.bgr.awakening",
      "nameKey": "party.bgr.awakening.name",
      "color": "#5B6B2F"
    },
    {
      "id": "party.bgr.left",
      "nameKey": "party.bgr.left.name",
      "color": "#C8302C"
    },
    {
      "id": "party.bgr.herewe",
      "nameKey": "party.bgr.herewe.name",
      "color": "#4A9BD1"
    },
    {
      "id": "party.bgr.glory",
      "nameKey": "party.bgr.glory.name",
      "color": "#6D4C8F"
    },
    {
      "id": "party.bgr.honour",
      "nameKey": "party.bgr.honour.name",
      "color": "#7F6A4D"
    },
    {
      "id": "party.bgr.aer",
      "nameKey": "party.bgr.aer.name",
      "color": "#5A7FB0"
    }
  ],
  "regimeIndicators": {
    "judicialIndependence": 42,
    "mediaFreedom": 52,
    "electoralIntegrity": 55,
    "civilLiberties": 72,
    "legislativeConstraint": 62,
    "civilianControlOfMilitary": 90
  },
  "government": {
    "system": "Parliamentary",
    "chamber": "chamber.bgr.national_assembly",
    "headOfState": "char.bgr.president",
    "noConfidence": {
      "procedure": "procedure.bgr.no_confidence",
      "signatures": 48,
      "cooldownDays": 180
    }
  }
}
