{
  "$schema": "../../schemas/country.schema.json",
  "meta": {
    "sources": [
      "src.seatofpower_authored"
    ],
    "notes": "Generated by tools/pipeline/author_bgr.py (package 27)."
  },
  "id": "country.mkd",
  "depth": "Light",
  "nameKey": "country.mkd.name",
  "iso3": "MKD",
  "entityType": "Country",
  "regimeType": "ElectoralDemocracy",
  "currency": "MKD",
  "capitalKey": "country.mkd.capital",
  "mapColor": "#C4862F",
  "leaderCharacterId": "char.mkd.leader"
}
