{
  "$schema": "../../schemas/country.schema.json",
  "meta": {
    "sources": [
      "src.seatofpower_authored"
    ],
    "notes": "Generated by tools/pipeline/author_bgr.py (package 27)."
  },
  "id": "country.rus",
  "depth": "Light",
  "nameKey": "country.rus.name",
  "iso3": "RUS",
  "entityType": "Country",
  "regimeType": "ClosedAutocracy",
  "currency": "RUB",
  "capitalKey": "country.rus.capital",
  "mapColor": "#7A3B3B",
  "leaderCharacterId": "char.rus.leader"
}
